### ISSUE TITLE
lnd does not listen on 0.0.0.0:9735 either by default or with explicit listen=0.0.0.0:9735

### ISSUE THREAD

**Issue by doc-sportello** [lightningnetwork/lnd#1815]
### Background

lnd does not listen on 0.0.0.0:9735 with default configuration.
lnd does not listen on 0.0.0.0:9735 with listen=0.0.0.0:9735 explicitly configured.
It does in both cases listen only on :::9735 (ipv6).

When I specified ipv4 address of the interface explicitly (listen=x.x.x.x:9735) it starts to listen on that ipv4:port as expected (and stops listening on :::9735 (ipv6)).
But I am still not getting any inbound connections from peers. I am advertising my external static IP behind which I am NAT'd.

### Your environment

* version of `lnd`
0.5.0-beta-rc1
* which operating system (`uname -a` on *Nix)
Linux raspberrypi 4.14.66-v7+ #1137 SMP Fri Aug 24 16:36:53 BST 2018 armv7l GNU/Linux
* version of `btcd`, `bitcoind`, or other backend
bitcoind 0.16.2
* any other relevant environment details
NAT behind fixed IP

### Steps to reproduce

modify lnd.conf
check netstat -nat

### Expected behaviour

lnd should listen for ipv4 connections.

### Actual behaviour

lnd listens only for ipv6 connections.

**Comment by Roasbeef** [comment]
Can you confirm that nodes are actually unable to connect inbound and it isn't an issue with your NAT set up?

**Comment by doc-sportello** [comment]
I can confirm it is not a NAT issue - took a pcap which shows inbound traffic from the internet to my node 10.0.0.37:9735:
```
11:26:35.417257 IP 195.201.208.20.40696 > 10.0.0.37.9735: Flags [S], seq 1415188624, win 29200, options [mss 1460,sackOK,TS val 950082794 ecr 0,nop,wscale 7], length 0
11:26:35.417385 IP 10.0.0.37.9735 > 195.201.208.20.40696: Flags [S.], seq 302073097, ack 1415188625, win 28960, options [mss 1460,sackOK,TS val 2484580132 ecr 950082794,nop,wscale 7], length 0
11:26:36.394000 IP 195.201.208.20.40696 > 10.0.0.37.9735: Flags [.], ack 1, win 229, options [nop,nop,TS val 950083038 ecr 2484580132], length 0
11:26:36.394483 IP 195.201.208.20.40696 > 10.0.0.37.9735: Flags [P.], seq 1:51, ack 1, win 229, options [nop,nop,TS val 950083039 ecr 2484580132], length 50
11:26:36.394620 IP 10.0.0.37.9735 > 195.201.208.20.40696: Flags [.], ack 51, win 227, options [nop,nop,TS val 2484581109 ecr 950083039], length 0
11:26:36.410600 IP 10.0.0.37.9735 > 195.201.208.20.40696: Flags [P.], seq 1:51, ack 51, win 227, options [nop,nop,TS val 2484581125 ecr 950083039], length 50
11:26:37.389884 IP 195.201.208.20.40696 > 10.0.0.37.9735: Flags [.], ack 51, win 229, options [nop,nop,TS val 950083287 ecr 2484581125], length 0
11:26:37.391401 IP 195.201.208.20.40696 > 10.0.0.37.9735: Flags [P.], seq 51:117, ack 51, win 229, options [nop,nop,TS val 950083288 ecr 2484581125], length 66
11:26:37.391469 IP 195.201.208.20.40696 > 10.0.0.37.9735: Flags [P.], seq 117:135, ack 51, win 229, options [nop,nop,TS val 950083288 ecr 2484581125], length 18
11:26:37.391493 IP 195.201.208.20.40696 > 10.0.0.37.9735: Flags [P.], seq 135:157, ack 51, win 229, options [nop,nop,TS val 950083288 ecr 2484581125], length 22
11:26:37.407806 IP 10.0.0.37.9735 > 195.201.208.20.40696: Flags [P.], seq 51:69, ack 157, win 227, options [nop,nop,TS val 2484582122 ecr 950083288], length 18
11:26:37.407944 IP 10.0.0.37.9735 > 195.201.208.20.40696: Flags [P.], seq 69:92, ack 157, win 227, options [nop,nop,TS val 2484582123 ecr 950083288], length 23
11:26:38.374651 IP 195.201.208.20.40696 > 10.0.0.37.9735: Flags [.], ack 92, win 229, options [nop,nop,TS val 950083534 ecr 2484582122], length 0
11:26:38.376358 IP 195.201.208.20.40696 > 10.0.0.37.9735: Flags [F.], seq 157, ack 92, win 229, options [nop,nop,TS val 950083534 ecr 2484582122], length 0
11:26:38.383507 IP 10.0.0.37.9735 > 195.201.208.20.40696: Flags [F.], seq 92, ack 158, win 227, options [nop,nop,TS val 2484583098 ecr 950083534], length 0
11:26:39.208120 IP 195.201.208.20.40696 > 10.0.0.37.9735: Flags [.], ack 93, win 229, options [nop,nop,TS val 950083742 ecr 2484583098], length 0
```
pcap file:
[lnd1.zip](https://github.com/lightningnetwork/lnd/files/2339569/lnd1.zip)

Still no inbound peers established:
```
netstat -an | grep 9735
tcp        0      0 10.0.0.37:9735          0.0.0.0:*               LISTEN
tcp        0      0 10.0.0.37:45206         92.53.89.123:9735       ESTABLISHED
tcp        0      0 10.0.0.37:42152         213.136.87.165:9735     ESTABLISHED
tcp        0      0 10.0.0.37:37630         108.51.23.132:9735      ESTABLISHED
tcp        0      0 10.0.0.37:33158         206.116.15.124:9735     ESTABLISHED
tcp        0      0 10.0.0.37:53426         35.231.154.254:9735     ESTABLISHED
```

**Comment by Roasbeef** [comment]
If you have those 4 inbound peers, then it would appear that you're able to _accept_ inbound payments. Why are you expecting inbound peers to automatically arrive at your node? Out of the box, `lnd` will listen on IPv4, and IPv6 as well is available.

> Isn't that unusual?

Bitcoin peers need to connect inbound in order to receive new blocks etc. Lightning peers only really need to be established _if_ you have a channel with another node. 

Closing this as the networking stack is working fine, and it isn't unusual for you _not_ to have existing connections which aren't actually peers seeking to open channels, or maintain already exposed channels.

**Comment by doc-sportello** [comment]
@Roasbeef :Thank you for your explanation.
My point was that out of the box `lnd` _seemed_ to be listening only on ipv6 (no ipv4) as checked by output of `netstat -an`:
```
tcp6       0      0 :::9735                 :::*                    LISTEN
```
As opposed to e.g. bitcoin port 8333:
```
tcp        0      0 0.0.0.0:8333            0.0.0.0:*               LISTEN
tcp6       0      0 :::8333                 :::*                    LISTEN
```

But then when I tested the connection to port 9735 it worked, even though it still showed as tcp6:
```
tcp6       0      0 10.0.0.37:9735          10.0.0.33:55491         ESTABLISHED
```
I did not realize it is due to RFC 3493.
Sorry for opening unnecessary issue.

**Comment by monkey-jsun** [comment]
@doc-sportello  I stumble across the same issue, where I only see port 9735 opened for IPv6, not IPv4.  I don't know how to test the connect to port 9735.  Any suggestions?

Also, I don't see RFC 3493 is related to this issue.  Can you elaborate more?  I'm sure I'm not the only one that come to this place and still feel puzzled after reading the discussion. 

Thanks!

**Comment by 3nprob** [comment]
@monkey-jsun Did you perhaps specify `listen=localhost` in your config? If you change or supplement that with an explicit `127.0.0.1` (or whatever ipv4 address) it should work.
